[
  {
    "verification_id": "VERIF-UNKNOWN_BID-REQ-GEM7379634-001",
    "requirement_id": "REQ-GEM7379634-001",
    "bid_id": "UNKNOWN_BID",
    "status": "MISSING",
    "severity": "CRITICAL",
    "expected": "== 180 COUNT",
    "actual": "MISSING",
    "operator_used": "==",
    "reason": "No bidder evidence submitted for 'bid_validity_days'.",
    "evidence": [],
    "requires_human_review": true
  },
  {
    "verification_id": "VERIF-UNKNOWN_BID-REQ-GEM7379634-002",
    "requirement_id": "REQ-GEM7379634-002",
    "bid_id": "UNKNOWN_BID",
    "status": "MISSING",
    "severity": "MINOR",
    "expected": "== No",
    "actual": "MISSING",
    "operator_used": "==",
    "reason": "No bidder evidence submitted for 'mse_relaxation'.",
    "evidence": [],
    "requires_human_review": false
  },
  {
    "verification_id": "VERIF-UNKNOWN_BID-REQ-GEM7379634-003",
    "requirement_id": "REQ-GEM7379634-003",
    "bid_id": "UNKNOWN_BID",
    "status": "MISSING",
    "severity": "MINOR",
    "expected": "== No",
    "actual": "MISSING",
    "operator_used": "==",
    "reason": "No bidder evidence submitted for 'startup_relaxation'.",
    "evidence": [],
    "requires_human_review": false
  },
  {
    "verification_id": "VERIF-UNKNOWN_BID-REQ-GEM7379634-004",
    "requirement_id": "REQ-GEM7379634-004",
    "bid_id": "UNKNOWN_BID",
    "status": "MISSING",
    "severity": "CRITICAL",
    "expected": "EXISTS Compliance of BoQ specification and supporting document",
    "actual": "MISSING",
    "operator_used": "EXISTS",
    "reason": "Mandatory requirement 'Seller must submit Compliance of BoQ specification and supporting document. In case any bidder is seeking exemption from Experience / Turnover Criteria, the supporting documents to prove eligibility for exemption must be uploaded.' not satisfied: document/evidence is missing.",
    "evidence": [],
    "requires_human_review": true
  },
  {
    "verification_id": "VERIF-UNKNOWN_BID-REQ-GEM7379634-005",
    "requirement_id": "REQ-GEM7379634-005",
    "bid_id": "UNKNOWN_BID",
    "status": "MISSING",
    "severity": "CRITICAL",
    "expected": "BETWEEN 20-30 Days DAYS",
    "actual": "MISSING",
    "operator_used": "BETWEEN",
    "reason": "No bidder evidence submitted for 'delivery_days'.",
    "evidence": [],
    "requires_human_review": true
  },
  {
    "verification_id": "VERIF-UNKNOWN_BID-REQ-GEM7379634-006",
    "requirement_id": "REQ-GEM7379634-006",
    "bid_id": "UNKNOWN_BID",
    "status": "MISSING",
    "severity": "CRITICAL",
    "expected": "== post CRAC as per GeM Policy",
    "actual": "MISSING",
    "operator_used": "==",
    "reason": "No bidder evidence submitted for 'payment_terms'.",
    "evidence": [],
    "requires_human_review": true
  },
  {
    "verification_id": "VERIF-UNKNOWN_BID-REQ-GEM7379634-007",
    "requirement_id": "REQ-GEM7379634-007",
    "bid_id": "UNKNOWN_BID",
    "status": "MISSING",
    "severity": "CRITICAL",
    "expected": "== Yes",
    "actual": "MISSING",
    "operator_used": "==",
    "reason": "No bidder evidence submitted for 'financial_document'.",
    "evidence": [],
    "requires_human_review": true
  },
  {
    "verification_id": "VERIF-UNKNOWN_BID-REQ-GEM7379634-008",
    "requirement_id": "REQ-GEM7379634-008",
    "bid_id": "UNKNOWN_BID",
    "status": "MISSING",
    "severity": "MINOR",
    "expected": "<= 15% COUNT",
    "actual": "MISSING",
    "operator_used": "<=",
    "reason": "No bidder evidence submitted for 'mse_preference_margin'.",
    "evidence": [],
    "requires_human_review": false
  },
  {
    "verification_id": "VERIF-UNKNOWN_BID-REQ-GEM7379634-009",
    "requirement_id": "REQ-GEM7379634-009",
    "bid_id": "UNKNOWN_BID",
    "status": "MISSING",
    "severity": "MINOR",
    "expected": "<= 25% COUNT",
    "actual": "MISSING",
    "operator_used": "<=",
    "reason": "No bidder evidence submitted for 'mse_preference_percent'.",
    "evidence": [],
    "requires_human_review": false
  },
  {
    "verification_id": "VERIF-UNKNOWN_BID-REQ-GEM7379634-010",
    "requirement_id": "REQ-GEM7379634-010",
    "bid_id": "UNKNOWN_BID",
    "status": "MISSING",
    "severity": "CRITICAL",
    "expected": "== Only supply of Goods",
    "actual": "MISSING",
    "operator_used": "==",
    "reason": "No bidder evidence submitted for 'scope_of_supply'.",
    "evidence": [],
    "requires_human_review": true
  },
  {
    "verification_id": "VERIF-UNKNOWN_BID-REQ-GEM7379634-011",
    "requirement_id": "REQ-GEM7379634-011",
    "bid_id": "UNKNOWN_BID",
    "status": "MISSING",
    "severity": "CRITICAL",
    "expected": "EXISTS compliance with all applicable labour laws",
    "actual": "MISSING",
    "operator_used": "EXISTS",
    "reason": "Mandatory requirement 'All GeM Sellers/Service Providers shall ensure full compliance with all applicable labour laws, including the provisions, rules, schemes and guidelines under the four Labour Codes.' not satisfied: document/evidence is missing.",
    "evidence": [],
    "requires_human_review": true
  },
  {
    "verification_id": "VERIF-UNKNOWN_BID-REQ-GEM7379634-012",
    "requirement_id": "REQ-GEM7379634-012",
    "bid_id": "UNKNOWN_BID",
    "status": "MISSING",
    "severity": "CRITICAL",
    "expected": "EXISTS registered with the Competent Authority",
    "actual": "MISSING",
    "operator_used": "EXISTS",
    "reason": "Mandatory requirement 'Any bidder from a country which shares a land border with India will be eligible to bid in this tender only if the bidder is registered with the Competent Authority.' not satisfied: document/evidence is missing.",
    "evidence": [],
    "requires_human_review": true
  }
]